{
  "$schema": "https://json-schema.org/draft/2020-12/schema",
  "type": "array",
  "items": {
    "type": "object",
    "required": ["id", "name", "danger", "statBias", "flavor"],
    "properties": {
      "id": { "type": "string" },
      "name": { "type": "string" },
      "danger": { "type": "number" },
      "statBias": { "type": "string" },
      "flavor": { "type": "string" }
    }
  }
}

